<?xml version="1.0" encoding="utf-8"?>

<!DOCTYPE column-panel SYSTEM "sierra.dtd">

<column-panel spacing="4" padding="8" opaque="true">
    <row-panel>
        <button text="1a"/>
        <spacer width="4"/>
        <button text="1b"/>
        <spacer width="4"/>
        <button text="1c"/>
        <spacer weight="1"/>
    </row-panel>
    <row-panel>
        <spacer weight="1"/>
        <button text="2a"/>
        <spacer width="4"/>
        <button text="2b"/>
        <spacer width="4"/>
        <button text="2c"/>
    </row-panel>
    <row-panel>
        <spacer weight="1"/>
        <button text="3a"/>
        <spacer width="4"/>
        <button text="3b"/>
        <spacer width="4"/>
        <button text="3c"/>
        <spacer weight="1"/>
    </row-panel>
    <button text="4" weight="1"/>
</column-panel>
