<?xml version="1.0" encoding="utf-8"?>

<!DOCTYPE column-panel SYSTEM "sierra.dtd">

<column-panel spacing="4" padding="4" opaque="true">
    <row-panel alignToBaseline="true" spacing="4">
        <label text="abcd" horizontalAlignment="center" border="#c0c0c0" weight="3"/>
        <label text="efg" horizontalAlignment="center" border="#c0c0c0" weight="2"/>

        <label text="hijk lmnop" horizontalAlignment="center" styleClass="h1" border="#c0c0c0" weight="1"/>
    </row-panel>

    <label text="abcd" horizontalAlignment="center" border="#c0c0c0" weight="3"/>
    <label text="efg" horizontalAlignment="center" border="#c0c0c0" weight="2"/>

    <label text="hijk lmnop" horizontalAlignment="center" styleClass="h1" border="#c0c0c0" weight="1"/>
</column-panel>
