<?xml version="1.0" encoding="utf-8"?>

<!DOCTYPE column-panel SYSTEM "sierra.dtd">

<column-panel spacing="4" alignToGrid="true" padding="8">
    <row-panel>
        <text-pane text="A" horizontalAlignment="center" alignmentX="0.25" alignmentY="0.0" border="silver"/>
        <spacer size="60, 45" border="silver"/>
        <text-pane text="B" verticalAlignment="center" alignmentX="0.0" alignmentY="0.75" border="silver"/>
    </row-panel>

    <row-panel>
        <spacer size="120, 45" border="silver"/>
        <text-pane text="C" horizontalAlignment="center" verticalAlignment="center" border="silver"/>
        <spacer size="120, 45" border="silver"/>
    </row-panel>

    <row-panel>
        <text-pane text="D" verticalAlignment="center" alignmentX="1.0" alignmentY="0.25" border="silver"/>
        <spacer size="0, 45" border="silver"/>
        <text-pane text="E" horizontalAlignment="center" alignmentX="0.75" alignmentY="1.0" border="silver"/>
    </row-panel>
</column-panel>
